{
  "$schema": "../specs/device-profile.schema.json",
  "schemaVersion": 1,
  "id": "dji-mic-2",
  "displayName": "DJI Mic 2",
  "vendor": "DJI",
  "model": "DMT02 / DMR02",
  "support": {
    "status": "research",
    "notes": "Windows settings can select DJI Mic 2 and report a real recording endpoint, but continuous recording and transmitter-control mapping are not yet accepted on real hardware."
  },
  "identity": {
    "bluetoothNamePrefixes": [
      "DJI-MIC2",
      "DJI Mic 2"
    ],
    "audioInputNamePrefixes": [
      "DJI-MIC2",
      "DJI Mic 2"
    ]
  },
  "transports": [
    {
      "kind": "usb-digital-audio",
      "role": "voice-input",
      "status": "research",
      "notes": "DJI officially documents connecting the receiver to a computer by USB-C. Device enumeration and channel behavior must be verified on each desktop platform."
    },
    {
      "kind": "bluetooth-br-edr-audio",
      "role": "voice-input",
      "status": "planned",
      "notes": "Windows 11 real-device evidence confirms the transmitter can expose the standard Bluetooth HFP Hands-Free recording path. Availability remains platform/device-state dependent and is verified by the audio-input endpoint, not pairing alone."
    }
  ],
  "capabilities": [
    "voice-capture",
    "gain-control",
    "channel-selection",
    "device-status"
  ],
  "protocols": [
    {
      "id": "dji-device-specific-audio-and-control",
      "status": "research",
      "notes": "No undocumented Bluetooth or control protocol is claimed or implemented."
    }
  ],
  "platforms": [
    {
      "platform": "macos",
      "status": "planned",
      "notes": "The existing CoreAudio input selector can route a user-selected DJI Mic 2 input; device-specific detection and real-device acceptance are in progress."
    },
    {
      "platform": "windows",
      "status": "planned",
      "notes": "Windows Bluetooth HFP identity and recording endpoints are confirmed on real hardware. A dedicated selectable settings page and endpoint diagnostics are implemented as a build candidate; continuous recording and physical-control acceptance remain pending."
    },
    {
      "platform": "linux",
      "status": "research",
      "notes": "Start with receiver-over-USB audio enumeration; Bluetooth is a separate research path."
    }
  ],
  "sources": [
    "https://www.dji.com/mic-2/specs",
    "https://www.dji.com/mic-2/faq",
    "https://dl.djicdn.com/downloads/DJI_Mic_2/UM/DJI_Mic_2_User_Manual__V1.0_EN.pdf",
    "https://www.dji.com/osmo-pocket-3/specs"
  ]
}
